{
  "name": "Scarlenny Guaragna",
  "targetOpportunity": "Cybersecurity internship",
  "specificPosting": "unknown",
  "links": {
    "github": "https://github.com/scarlenny"
  },
  "education": [
    {
      "institution": "Alvernia University",
      "location": "Reading, PA",
      "credential": "B.S. Cybersecurity",
      "status": "in progress",
      "expectedCompletion": "2028-05",
      "gpa": null
    },
    {
      "institution": "Reading Area Community College",
      "location": "Reading, PA",
      "credential": "A.S. Science Transfer",
      "status": "completed",
      "completed": "2024-05",
      "gpa": null
    },
    {
      "institution": "Integral Nuestra Senora de Fatima",
      "location": "Santiago, Dominican Republic",
      "credential": "High School Diploma with technical track",
      "credentialAsTranslated": "Vocational Studies in Data Entry",
      "status": "completed",
      "completed": "2011",
      "courses": [
        "Programming II",
        "Systems",
        "Corporative Database",
        "Web Pages",
        "Internet Services",
        "Applied Data Entry I",
        "Applied Data Entry II",
        "Legislation and Ethics",
        "Small Business"
      ],
      "note": "Course and credential titles are quoted from the notarized English translation. The student, a native Spanish speaker, disputes the accuracy of that translation. See questionsToResolve."
    }
  ],
  "projects": [
    {
      "title": "Bibliophile's Haven PostgreSQL Bookstore Database",
      "status": "completed",
      "tools": ["PostgreSQL", "pgAdmin 4", "SQL"],
      "actions": [
        "Designed a five-table relational schema",
        "Produced an entity relationship diagram",
        "Wrote six SQL queries against the schema"
      ],
      "measuredOutcome": null
    },
    {
      "title": "AI 101 Lab 3 Portfolio",
      "status": "in progress",
      "tools": ["HTML", "CSS", "Git", "GitHub Pages"],
      "actions": [
        "Building a single-file, mobile-responsive index.html portfolio",
        "Auditing AI-generated drafts against source documents before publication"
      ],
      "measuredOutcome": null
    }
  ],
  "workOrService": [
    {
      "organization": "United States Navy",
      "title": "Builder Third Class (BU3)",
      "location": "Port Hueneme, CA",
      "start": "2016-12",
      "end": "2020-06",
      "actions": [
        "Performed pre-deployment preparation and project planning and estimating of construction materials",
        "Inventoried and classified underwater construction equipment with Underwater Construction Team 2",
        "Transported 15 personnel a total of 390 miles to LAX in support of battalion deployment readiness",
        "Served as Voluntary Education Coordinator",
        "Stood POOW and MOOW watches",
        "Informally supervised a work party"
      ],
      "formalDirectReports": 0
    },
    {
      "organization": "Heart to Heart Home Care",
      "title": "Home Health Aide",
      "location": "Brooklyn, NY",
      "start": "2020",
      "end": "2022",
      "actions": [
        "Scheduled appointments and arranged client transportation",
        "Monitored vital signs and referred concerns to healthcare professionals",
        "Prepared daily activity reports and maintained client confidentiality"
      ]
    },
    {
      "organization": "Freedom Care LLC",
      "title": "Personal Care Assistant",
      "location": "Brooklyn, NY",
      "start": "2016-03",
      "end": "2016-12",
      "actions": [
        "Coordinated with physicians, nurses, and therapists on client care",
        "Documented activities for case management and compliance",
        "Assisted clients with daily activities and dietary needs"
      ]
    }
  ],
  "skills": {
    "technical": ["SQL", "PostgreSQL", "pgAdmin 4", "Relational schema design", "ERD design"],
    "currentlyDeveloping": [
      "Linux and Kali command line",
      "Bash scripting",
      "Windows and PowerShell",
      "VirtualBox",
      "Python",
      "Git",
      "Wireshark",
      "Networking fundamentals"
    ],
    "complianceAndRecords": [
      "HIPAA and Privacy Act training",
      "DON records management",
      "DoD Cyber Awareness Challenge",
      "OPSEC",
      "Medical documentation"
    ],
    "languages": [
      { "language": "Spanish", "level": "native" },
      { "language": "English", "level": "fluent" },
      { "language": "French", "level": "beginner" },
      { "language": "Japanese", "level": "beginner" },
      { "language": "Italian", "level": "beginner" }
    ]
  },
  "questionsToResolve": [
    "Exact Alvernia University GPA",
    "Exact Navy discharge date in June 2020",
    "Whether to obtain a corrected re-translation of the Dominican high school transcript",
    "Current class standing at Alvernia University"
  ],
  "measuredOutcomesAvailable": false
}
